UnitCode,UnitName,GroupCode,GroupName,SiteCode,SiteName,StartDate,BM_Latitude,BM_Longitude,LatLong_Datum,QAQC,Conditions_Swell,Conditions_Wind,Conditions_Rain,Conditions_RecentRain,Substrate_Sediment,Substrate_Scour,Substrate_RockMvmnt,Debris_PlantWrack,Debris_Driftwood,Debris_Shells,Debris_DeadAnimals,Debris_Trash,Debris_OilTar,Notes_Conditions,Notes_Marker,Notes_Other,Notes_Additional_Spp,IsPointCUI
ACAD,Acadia National Park,NETN,Northeast Temperate Network,BASHAR,Bass Harbor,6/24/2013,44.2248116,-68.3220461,WGS84,TRUE,Absent,Low,Absent,Low,Absent,Absent,Absent,Absent,Absent,Absent,Absent,Absent,Absent,None,None,Plot R4 accidentally skipped for photos.,,FALSE
ACAD,Acadia National Park,NETN,Northeast Temperate Network,BASHAR,Bass Harbor,6/21/2014,44.2248116,-68.3220461,WGS84,FALSE,Low,Medium,Absent,Absent,Low,Low,Low,Absent,Absent,Absent,Low,Absent,Absent,Another day with perfect weather. Barnacle plots significantly overgrown with Fucus.,X3N bolt may be lost. Could not locate the bolt; need good triangulation numbers from other points.,"In Photo 9, the tidepool transects are reversed (numbers and letters). Tidepool X3 probably not suitable - no kelp.",,FALSE
ACAD,Acadia National Park,NETN,Northeast Temperate Network,BASHAR,Bass Harbor,6/29/2024,44.2248116,-68.3220461,WGS84,FALSE,Low,Medium,Absent,,Low,Low,Low,Low,Absent,Medium,Medium,Absent,Absent,This site is awesome.,,Question if T1/T3 data sheets were switched halway through - resolved,"Hermit crabs, toad crab, dorid nudi eggs, colonial tunicates (goldenstar and orange sheath tunicate). Bread crumb sponge - nice tide pool.",FALSE
ACAD,Acadia National Park,NETN,Northeast Temperate Network,BASHAR,Bass Harbor,6/21/2013,44.2248116,-68.3220461,WGS84,FALSE,Low,Low,Absent,Absent,Low,Low,Low,Absent,Absent,Absent,Absent,Absent,Absent,Another fine day!,Pulled extra bolt on vert transect 2,None,,FALSE
ACAD,Acadia National Park,NETN,Northeast Temperate Network,BASHAR,Bass Harbor,6/12/2023,44.2248116,-68.3220461,WGS84,FALSE,Low,Low,Absent,,Low,Medium,Low,Absent,Absent,Medium,High,Low,Absent,Bird scat everywhere; lots of dead cancer crab predation,,"Found golden star tunicate, rock gunnels, rough nudibranchs",,FALSE
ACAD,Acadia National Park,NETN,Northeast Temperate Network,BASHAR,Bass Harbor,6/11/2019,44.2248116,-68.3220461,WGS84,FALSE,Low,Medium,High,Absent,Low,Low,Low,Low,Low,Low,Low,Low,Absent,Lot's of trash in upper areas,NA,NA,,FALSE
ACAD,Acadia National Park,NETN,Northeast Temperate Network,BASHAR,Bass Harbor,5/18/2018,44.2248116,-68.3220461,WGS84,FALSE,Low,Low,Absent,Absent,Low,Low,Low,Absent,Absent,Low,Low,Absent,Absent,"Relative to other sites this year, the band of turfing green algae was smaller.","T1 - 20, missing - no hole found; replaced between 19 + 21 (FIXED)",none,none,FALSE
ACAD,Acadia National Park,NETN,Northeast Temperate Network,BASHAR,Bass Harbor,6/28/2016,44.2248116,-68.3220461,WGS84,FALSE,Low,Medium,Absent,Absent,Low,Absent,Low,Absent,Absent,Low,Low,Absent,Absent,,,,Horse mussels,FALSE
ACAD,Acadia National Park,NETN,Northeast Temperate Network,BASHAR,Bass Harbor,6/25/2017,44.2248116,-68.3220461,WGS84,FALSE,Medium,Low,Absent,Present,Low,Low,Low,Low,Low,Low,Low,Low,Absent,Tidepools do not have much water.,T3 bolt 9 replaced; T1 bolt 20 missing.,None,None,FALSE
ACAD,Acadia National Park,NETN,Northeast Temperate Network,BASHAR,Bass Harbor,6/12/2019,44.2248116,-68.3220461,WGS84,TRUE,,,,,,,,,,,,,,,,,,FALSE
ACAD,Acadia National Park,NETN,Northeast Temperate Network,BASHAR,Bass Harbor,6/12/2015,44.2248116,-68.3220461,WGS84,FALSE,Low,Medium,Absent,Low,Absent,Low,Absent,Absent,Absent,Low,Low,Low,Absent,,N/A,"Adam J. Kozlowski was also listed as a recorded on the datasheets. Hermit crabs, clam worms, and arthropods were seen during the course of the survey.",Hermit crabsm clam worm and amphipid(?) were seen.,FALSE
ACAD,Acadia National Park,NETN,Northeast Temperate Network,BASHAR,Bass Harbor,5/22/2022,44.2248116,-68.3220461,WGS84,FALSE,Medium,Low,Absent,Present,Low,Low,Absent,Low,Absent,Low,Low,Low,Absent,Nothing out of the ordinary. Adam would like to note dense fog.,,Nothing. Perhaps first season without repairing sites.,"Lots of hermit crabs, one waved whelk, one toad crab",FALSE
ACAD,Acadia National Park,NETN,Northeast Temperate Network,BASHAR,Bass Harbor,7/18/2021,44.2248116,-68.3220461,WGS84,FALSE,Low,Low,High,Absent,Low,Absent,Absent,Low,Absent,Low,Low,Low,Absent,None,None,None,,FALSE
ACAD,Acadia National Park,NETN,Northeast Temperate Network,SHIHAR,Ship Harbor,5/23/2018,44.22532614,-68.31775067,WGS84,TRUE,,,,,,,,,,,,,,,,,,FALSE
ACAD,Acadia National Park,NETN,Northeast Temperate Network,SHIHAR,Ship Harbor,6/11/2015,44.22532614,-68.31775067,WGS84,FALSE,Low,Medium,Absent,Absent,Absent,Low,Low,Low,Low,Low,Low,Low,Absent,,,3 out of 5 barnacle plots are encroached by Fucus.,,FALSE
ACAD,Acadia National Park,NETN,Northeast Temperate Network,SHIHAR,Ship Harbor,6/30/2024,44.22532614,-68.31775067,WGS84,FALSE,Medium,Medium,Absent,Absent,Medium,Medium,High,Medium,Absent,Medium,Medium,Low,Absent,Complete loss of A4,A4 flipped over off rock. New plot 4 installed.,,Rock gunnel (2),FALSE
ACAD,Acadia National Park,NETN,Northeast Temperate Network,SHIHAR,Ship Harbor,6/29/2016,44.22532614,-68.31775067,WGS84,FALSE,Low,Low,Low,Low,Low,Low,Low,Low,Low,Low,Medium,Low,Low,Very foggy and damp. Light rain interspersed over an hour.,"Fix guidebooks: photo 10 x3 not x1, map 6+7 are mislabled in the table of contents. Many bolts on transects are algae covered. Temp 3 holes not drilled deep enough.",False Rat's Brain - much more than other sites; small white bivalve - ~1/2in  in fucus plots and red plots.,False Rat's Brain - much more than other sites; small white bivalve - ~1/2in  in fucus plots and red plots.,FALSE
ACAD,Acadia National Park,NETN,Northeast Temperate Network,SHIHAR,Ship Harbor,5/20/2022,44.22532614,-68.31775067,WGS84,FALSE,Low,Low,Absent,Present,Medium,Low,Low,Low,Low,Low,Low,Low,Absent,,T2 - 11 Missing; not fixed,,Hermit crab Rat's Brain Old man's toenails,FALSE
ACAD,Acadia National Park,NETN,Northeast Temperate Network,SHIHAR,Ship Harbor,6/20/2014,44.22532614,-68.31775067,WGS84,FALSE,Low,Medium,Absent,Absent,Low,Low,Low,Low,Low,Low,Low,Low,Low,"Calm seas, temp in 60's, great day! Note some confusion on use of L and 0 for substratum and debris; many of the ""L"" values were probably ""0"".","T3 had extra bolt, and mid-bolt mislabeled on map. Mid-bolt is actually 13, and there is an unserveyed bolt between 10 and 11 on the map. So 11 becomes 12, 12 becomes 13, and so on.","X1 hard to find; took new inset photos, 1N then 1S. X2 and X3 both labeled X1 in photo. Took inset photo for X2S.",,FALSE
ACAD,Acadia National Park,NETN,Northeast Temperate Network,SHIHAR,Ship Harbor,6/22/2013,44.22532614,-68.31775067,WGS84,FALSE,Low,Low,Absent,Absent,Absent,Absent,Absent,Low,Absent,Low,Absent,Absent,Absent,None.,Photos for tidbits need editing. See attached and below.,PJC also recorded data. See tidbit ocation comments above.,,FALSE
ACAD,Acadia National Park,NETN,Northeast Temperate Network,SHIHAR,Ship Harbor,6/11/2023,44.22532614,-68.31775067,WGS84,FALSE,Low,Low,Absent,Present,Low,Medium,High,Medium,Low,Medium,Medium,Low,Absent,,"Temp 1 repaired, verts; minor repairs",ASCO 3 1/3 under boulder,Lot of cladophra in upper tidepools,FALSE
ACAD,Acadia National Park,NETN,Northeast Temperate Network,SHIHAR,Ship Harbor,5/21/2018,44.22532614,-68.31775067,WGS84,FALSE,Low,Low,Absent,Present,Low,Absent,Medium,Low,Absent,Low,Absent,Low,Absent,"Lots of ""OG"" in upper intertidal, short fuzzy green algae which covers most of CN; very slippery",T2 bolt 4: Bolt missing + replaced (Fixed),"1 harbor porpoise offshore; Guide error, photo of X3 is labeled X1 (see photo 3 of 3)","Chin snail (Lacuna vincta): R, ND, ND, - , in fucus plots ; Idotea baltica: U, M, ND, - , present in red plots",FALSE
ACAD,Acadia National Park,NETN,Northeast Temperate Network,SHIHAR,Ship Harbor,6/26/2017,44.22532614,-68.31775067,WGS84,FALSE,Low,Low,Absent,Low,Low,Low,Low,Low,Low,Low,Low,Low,Absent,"Lots of slimy ""other green"" ovoids on upper sections",T3 bolt 3 ; T2 bolt 7 gone but replaced.  No label for B4,,"rats brain (leathesia), no false rat's brain (colpemenia), hermit crabs",FALSE
ACAD,Acadia National Park,NETN,Northeast Temperate Network,SHIHAR,Ship Harbor,6/10/2019,44.22532614,-68.31775067,WGS84,FALSE,Low,Low,Absent,Low,Low,Low,Medium,Medium,Low,Low,Absent,Absent,Absent,NA,None,"Remove B4 note on guide; Chondras page in species guide has palmaria photos, needs fixing",NA,FALSE
ACAD,Acadia National Park,NETN,Northeast Temperate Network,SHIHAR,Ship Harbor,7/16/2021,44.22532614,-68.31775067,WGS84,FALSE,Medium,Medium,Absent,Present,Low,Low,Medium,High,Low,Low,Low,Low,Absent,None,T1: Bolt 4 removed from mobile boulder and re-drilled into nearest bedrock-see T datasheet for more detail (fixed); T3: Bolts 3&4 were reaplced in same holes (fixed),Colonial tutunicates were present in intertidal zone,None,FALSE
ACAD,Acadia National Park,NETN,Northeast Temperate Network,SCHPOI,Schoodic Point,6/19/2013,44.3335989,-68.058494,WGS84,FALSE,Low,Low,Absent,Low,Low,Medium,Medium,Absent,Absent,Absent,Absent,Absent,Absent,Great sampling weather,"Added label to end of T1, noted T1 and T3 top labels switched and moved them. Transect data sheet numbers fixed. Added bolts to all transects and surveyed. Data in total station has T1 and T3 swapped.",Sampled over 2 days (6/19/2013 and 6/20/2013),,FALSE
ACAD,Acadia National Park,NETN,Northeast Temperate Network,SCHPOI,Schoodic Point,6/22/2014,44.3335989,-68.058494,WGS84,TRUE,Low,Low,Absent,Absent,Absent,Absent,Absent,Absent,Absent,Absent,Low,Absent,Absent,None,None,None,,FALSE
ACAD,Acadia National Park,NETN,Northeast Temperate Network,SCHPOI,Schoodic Point,6/8/2023,44.3335989,-68.058494,WGS84,FALSE,Low,Medium,Absent,Present,Low,Low,Medium,Medium,Low,Low,Medium,Low,Absent,None,Numerous bent bolts,,,FALSE
ACAD,Acadia National Park,NETN,Northeast Temperate Network,SCHPOI,Schoodic Point,6/23/2017,44.3335989,-68.058494,WGS84,FALSE,Medium,Absent,Low,Present,Absent,Low,Low,Low,Absent,Low,Low,Low,Absent,tannic water in tide pools,T3 bolt 2 missing - reduce all numbers by 1. Temp 3 gone and replaced,,"toad crab, bushybactd(sp?) nudibranch, brittle star. False rat brain",FALSE
ACAD,Acadia National Park,NETN,Northeast Temperate Network,SCHPOI,Schoodic Point,6/25/2024,44.3335989,-68.058494,WGS84,FALSE,High,Low,Absent,Present,Absent,Medium,High,Low,Absent,Low,Low,Low,Absent,,A1; bent bolt. T1-3; missing under loose cobble and boulders.,,Leathesia,FALSE
ACAD,Acadia National Park,NETN,Northeast Temperate Network,SCHPOI,Schoodic Point,6/13/2019,44.3335989,-68.058494,WGS84,FALSE,Low,Low,Low,Absent,Low,Low,Medium,Low,Absent,Absent,Absent,Absent,Absent,NA,"T1 Bolt 1-3: First 3 bolts of T1 were under large cobble (see T1 sheet) Not fixed;       T3 Bolt 1: First bolt of T3 under a boulder,started tape very close from its location (inches) Not fixed",Many rent bolts,Nudibranch egg mass: fucus plots,FALSE
ACAD,Acadia National Park,NETN,Northeast Temperate Network,SCHPOI,Schoodic Point,5/17/2022,44.3335989,-68.058494,WGS84,FALSE,High,Low,Low,Absent,Absent,Low,Low,Low,Absent,Low,Low,Low,Absent,Bleaching present; see back of form 1. Cold (low 50s; high 40s),None of note,,,FALSE
ACAD,Acadia National Park,NETN,Northeast Temperate Network,SCHPOI,Schoodic Point,6/17/2014,44.3335989,-68.058494,WGS84,FALSE,Low,Low,Absent,Absent,Low,Low,Medium,Low,Low,Low,Low,Low,Low,"Weather/Sea conditions reflect first day of sampling. Second day: Swell: M; Wind: M; Rain: L; Recent Rain: M. Confusion about substratum/debris fields; should have used ""0"" for most but did not. Calm and clear on day 1, thunderstorm came through prior to sampling on Day 2, then drizzle and gradual clearing, moderate surf.","T3 is missing bolts 1 and 2; sampling started at bolt 3. T2 reinstalled label bolt and bolt 1. T3 mid-bolt label present, but no bolt. T1 bolt 3 is beneath bolt 2, under overhang.","Survey completed on 6/18/2014. Brian Mitchell assisted with data recording on Form 1. Settlement: U plots photographed first, then S. Fucus map (4) is correct. Photo 4, L to R: 5, 3, 4, 2, 1. Took photos of X3; guide photos hard to use.",,FALSE
ACAD,Acadia National Park,NETN,Northeast Temperate Network,SCHPOI,Schoodic Point,7/19/2021,44.3335989,-68.058494,WGS84,FALSE,Medium,Low,Absent,Absent,Absent,Low,Medium,Low,Absent,Low,Medium,Low,Absent,Tannins in water; Filamentous red algae understory of fucus and ascophyllum,See notes on vertical transect forms; S3 label bolt missing (fixed); Barnacle bolts bent badly en mass,None,None,FALSE
ACAD,Acadia National Park,NETN,Northeast Temperate Network,SCHPOI,Schoodic Point,6/24/2016,44.3335989,-68.058494,WGS84,FALSE,Low,Low,Absent,Medium,Low,Low,Low,Absent,Absent,Low,Absent,Low,Absent,,"T3 bolt needs replacement - replaced; Tidepools X1 and  X2 reversed in guide; Change photo 9 to be 1, 2, 3  N to S --> change to guides; B2 quadrats had severly bent bolts; T1 --> large slab rock moved over bolt 3 (rock 2ft x 5 ft); Correct  map to remove bolt 3.",Other species present on plot: rock gunnel and sculpin in tidepools.,rock gunnel and sculpin in tidepools,FALSE
ACAD,Acadia National Park,NETN,Northeast Temperate Network,SCHPOI,Schoodic Point,6/8/2015,44.3335989,-68.058494,WGS84,FALSE,Medium,Medium,Absent,Absent,Absent,Low,Low,Absent,Low,Low,Low,Low,Absent,,Replaced sheared T2 Bolt2. T3 map did not align with bolts onsite. Map had extra bolt somewhere between map's Bolt 1 + 2,"First day of the season; training day for new crew. S1 and U1 barnacle photos taken upside down. Barnacle plots (motile, photos, recruitment) were completed on 6/9/15. Tidepool transects were competed on 6/9/15.",,FALSE
ACAD,Acadia National Park,NETN,Northeast Temperate Network,SCHPOI,Schoodic Point,5/24/2018,44.3335989,-68.058494,WGS84,FALSE,Low,Low,Absent,Absent,Low,Low,High,Low,Absent,Low,Low,Low,Absent,red algal zone seems limted/ compressed,"T1 bolts 1-3: wiped out by moving rocks, too many loose rocks to restablish (not Fixed); FUC 2 +3: fixed bent bolts (Fixed); T2 +T3: repaired multiple bent bolts (Fixed)",Lots of rock movement in upper verticals; numerous bent bolts + loss of T1 bolt 1-3,,FALSE
ACAD,Acadia National Park,NETN,Northeast Temperate Network,LITHUN,Little Hunter,5/19/2018,44.29815123,-68.20857195,WGS84,FALSE,Medium,Absent,Absent,Absent,Low,Low,Low,Absent,Absent,Low,Low,Absent,Absent,"None; High  Algal diversity - and healthy; also see SHIHAR notes; Dead animal: insects in pool (crabs, urchins)","M4 label: pulled out, just hole (FIXED); MUS Bolts: several working their way out (FIXED); TEMP 2 pvc casing crushed, logger not damaged (FIXED); TEMP 1: checked because thought too deep but was fine, left as is (Not FIXED)",No serial numbers recorded but database couldn't populate existing serial numbers; HOBO logger plastic caps added to all these loggers,Jonah crab,FALSE
ACAD,Acadia National Park,NETN,Northeast Temperate Network,LITHUN,Little Hunter,7/15/2021,44.29815123,-68.20857195,WGS84,FALSE,Medium,Absent,Absent,Absent,Low,Low,Low,Absent,Absent,Low,Low,Absent,Absent,None,"T1-10: Missing, no hole found, placed as close as could be guess (fixed)","Bolts looked great, especially after year was skipped (2020)",None,FALSE
ACAD,Acadia National Park,NETN,Northeast Temperate Network,LITHUN,Little Hunter,6/10/2023,44.29815123,-68.20857195,WGS84,FALSE,Medium,Low,Absent,Absent,Low,Medium,Low,Low,Absent,Medium,Low,Absent,Absent,6/5 - Adam/Ed/Nick read all Ts and all reds. 6/10 full team read full site - T2 and reds.,,,Nudibranchs and old man's toenails,FALSE
ACAD,Acadia National Park,NETN,Northeast Temperate Network,LITHUN,Little Hunter,6/28/2017,44.29815123,-68.20857195,WGS84,FALSE,Low,Low,Absent,Present,Absent,Low,Low,Absent,Absent,Low,Low,Absent,Absent,Other green algae in upper intertidal not as prevalent as seen at other sites,"Bolt T2-5 missing, found hole and replaced. Installed Red 1-5 photoplots and reference bolt : took rough gps coordiantes :took guide pictures : took cover pictures : collected snails","old barnacle recruitment plate (granite - 5x5"" plate) Found Nearest B5 - it was removed. Anchor bolt and washer rusted through","Green Sponge, Large Isopods, Hermit Crabs, ""old man's toenails"" clams (name we made up)",FALSE
ACAD,Acadia National Park,NETN,Northeast Temperate Network,LITHUN,Little Hunter,5/19/2022,44.29815123,-68.20857195,WGS84,FALSE,Low,Medium,Absent,Present,Low,Low,Low,Absent,Absent,Low,Low,Absent,Absent,,,,"Sausage weed, rat's brain",FALSE
ACAD,Acadia National Park,NETN,Northeast Temperate Network,LITHUN,Little Hunter,6/27/2016,44.29815123,-68.20857195,WGS84,FALSE,Medium,Low,Absent,Absent,Low,Low,Low,Absent,Low,Medium,Low,Low,Absent,"Some shells in deep tide pools, many dead green crabs, some pieces of rope around site.",A3 has no label bolt or washer.,"Ascophyllum plots were photographed 1, 3, 4, 5. 2 was photographed later. Rock gunnel, sculpin found in tide pool 2. false rat's brain in mussels plots.","Rock gunnel, sculpin found in tide pool 2. false rat's brain in mussels plots.",FALSE
ACAD,Acadia National Park,NETN,Northeast Temperate Network,LITHUN,Little Hunter,6/27/2024,44.29815123,-68.20857195,WGS84,FALSE,Medium,Low,Low,Absent,Low,Low,Low,Low,Low,Low,Absent,Absent,Absent,,,,,FALSE
ACAD,Acadia National Park,NETN,Northeast Temperate Network,LITHUN,Little Hunter,6/8/2019,44.29815123,-68.20857195,WGS84,FALSE,Medium,Low,Absent,Low,Low,Low,Absent,Absent,Absent,Low,Absent,Absent,Absent,None,"Reds:Added red reference bolts. Add to MAPS                        ASCO: Label bolt A3 unable to be found-needs replacing, not fixed",None,"Nudibranch (Bushy backed), Arctic Rock Borer, GB Heron fly by",FALSE
ACAD,Acadia National Park,NETN,Northeast Temperate Network,LITHUN,Little Hunter,6/29/2017,44.29815123,-68.20857195,WGS84,TRUE,,,,,,,,,,,,,,,,Different observers/ recorders were involved in all activities for this QAQC visit.  Site Overview (form 1) is N/A,,FALSE
ACAD,Acadia National Park,NETN,Northeast Temperate Network,LITHUN,Little Hunter,6/5/2023,44.29815123,-68.20857195,WGS84,FALSE,,,,,,,,,,,,,,,,Adam/Ed/Nick read all T's and all Red algae plots on 6/5 because it was a very low tide.  Full crew returned on 6/10 to read the remainder of the plots at this location.,,FALSE
ACAD,Acadia National Park,NETN,Northeast Temperate Network,OTTPOI,Otter Point,6/19/2014,44.30687286,-68.19048707,WGS84,FALSE,Medium,Low,Absent,Low,Absent,Absent,Low,Low,Absent,Absent,Absent,Absent,Absent,"Small craft advisory yesterday, seas still rough.","One mussel plot (M3) missing a bolt, but not fixable (off edge of rock face). Some missing bolts on T2 and T3, perhaps... Not enough time to check. Extra bolt on T1, between 17 and 18, needs survey. Would really help to add labels to every 2nd/3rd T bolt. Maybe add pre-labeled washers.",Ed Sharron recorder for second page (1b). Add to SOP: wire brush top of all bolts! T2 and T3 could not be fully sampled due to surge.,,FALSE
ACAD,Acadia National Park,NETN,Northeast Temperate Network,OTTPOI,Otter Point,6/27/2017,44.30687286,-68.19048707,WGS84,FALSE,Low,Low,Absent,Absent,Low,Low,Medium,Absent,Absent,Low,Low,Low,Absent,lots of boulder movement (T3) Shifts in community profiles (mussel plots not dominant mussels anymore),T3- moved bolts 14 and on - New bolts 15-19 - No 20 or 21. New end bolt = 19 (more notes with transect data),"update location photos for mussel plots (M4, M5) overview","unidentified fish (in tide pool), hermit crab, ""old mans toenail"" clams",FALSE
ACAD,Acadia National Park,NETN,Northeast Temperate Network,OTTPOI,Otter Point,6/9/2023,44.30687286,-68.19048707,WGS84,FALSE,Medium,Low,Absent,,Low,Medium,High,Low,Absent,Medium,Medium,Low,Absent,Large amounts of Dumonte (dominant other red).,Replaced B1 label with B5,,"Rough nudibranhc, old man's toenails",FALSE
ACAD,Acadia National Park,NETN,Northeast Temperate Network,OTTPOI,Otter Point,6/10/2015,44.30687286,-68.19048707,WGS84,FALSE,High,Low,Absent,Low,Absent,Low,Medium,Absent,Absent,Low,Low,Low,Absent,Swell/Surge was 4-6 feet. Rock movement: lost 4-5 bolts on T3. Recent Rain was answered as 'yes - yesterday' on datasheet. Entered as 'Low' in DB to best capture response. CES - 20160112,See Transect Sheets but found 2 bolts on T2 that weren't RTK'ed (thanks metal detector!). Lost 4 bolts (#6-9) on T3 that were replaced. T3 needs label washers on 19 and 21.,"Bushy backed nudibranch (seaslug), green urchin, and isopods were observed druing the course of the survey. Data Entry Notes: Adam Kozlowski was also listed as a recorder on the datasheet.  CES 20170112",,FALSE
ACAD,Acadia National Park,NETN,Northeast Temperate Network,OTTPOI,Otter Point,5/20/2018,44.30687286,-68.19048707,WGS84,FALSE,Medium,Medium,Absent,Absent,Absent,Absent,Medium,Absent,Absent,Low,Absent,Absent,Absent,Wind affected tidepool searching because of rippled water surface. Wind made communication difficult.,"T3 - 7: Mistakenly labeled, changed to T3 - 9 (Fixed); Transects: Multiple bent bolts + washers (not Fixed); T2-12: labled washer (Fixed)",no vertical overview photo taken,,FALSE
ACAD,Acadia National Park,NETN,Northeast Temperate Network,OTTPOI,Otter Point,6/28/2024,44.30687286,-68.19048707,WGS84,FALSE,Low,Low,Absent,Present,Medium,Low,Medium,Medium,Low,Medium,Low,Low,Absent,None,Many repairs completed,,"Jingle shells (well distributed in tide pools), sculpins, rock gunnel",FALSE
ACAD,Acadia National Park,NETN,Northeast Temperate Network,OTTPOI,Otter Point,6/30/2016,44.30687286,-68.19048707,WGS84,TRUE,High,Low,Low,Low,Low,Low,Low,Absent,Low,Low,Medium,Low,Absent,"Tide was higher than expected, high swell - lower points on transects were more submerged than expected. Morning was fuggy.",See other OTTPOI notes,One lobster in tide pool 3; one sculpin in tide pool 1.,"lobster (tidepool 3), sculpin (tidepool 1)",FALSE
ACAD,Acadia National Park,NETN,Northeast Temperate Network,OTTPOI,Otter Point,7/17/2021,44.30687286,-68.19048707,WGS84,FALSE,Low,Low,Absent,Absent,Absent,Absent,Medium,Low,Low,Low,Low,Low,Absent,None,"T3: Lost T3-14 bolt clearly smashed under boulder (not fixed); T2: Lost T2-17 bolt lost in transect (lots of rock movement, not fixed); Fucus F1: Lower left bolt, rock corner used as surrogate (not fixed); Mussels M3: Lower right bolt (not fixed)",None,None,FALSE
ACAD,Acadia National Park,NETN,Northeast Temperate Network,OTTPOI,Otter Point,6/23/2013,44.30687286,-68.19048707,WGS84,FALSE,Low,Low,Absent,Low,Absent,Absent,Low,Absent,No Data,No Data,No Data,No Data,No Data,,"Vertical T3 had 2 lost bolts due to shifting on upper transect, and one on lower transect.","Accidentally missed threee summer scraping plot photos - U3, U4, U5. Took new photos for X1; south bolt hard to locate.",,FALSE
ACAD,Acadia National Park,NETN,Northeast Temperate Network,OTTPOI,Otter Point,6/26/2016,44.30687286,-68.19048707,WGS84,FALSE,Low,Low,Absent,Absent,Low,Low,Low,Absent,Absent,Low,Low,Absent,Absent,,T3 Bolt 19 - scraped 19 and higher on all sides of bolt,Colpemenia sp.- invasive brown algae (false rat's brain) found low in red zone. Abundance recorded as 'uncommon'. Sponged recorded as 'common' in tide pools.,Colpemenia sp.- invasive brown algae (false rat's brain) found low in red zone. Abundance recorded as 'uncommon'. Sponged recorded as 'common' in tide pools.,FALSE
ACAD,Acadia National Park,NETN,Northeast Temperate Network,OTTPOI,Otter Point,6/9/2019,44.30687286,-68.19048707,WGS84,FALSE,Low,Low,Absent,Low,Low,Low,Medium,Absent,Absent,Low,Low,Absent,Absent,NA,x1: South; north bolts switched in guide             B1:Replaced B1 label bolt               F1:Replaced F1 label bolt,35 people on cliff edge but didn’t come down; 2 deer also,"Old Man's Toenails (Arctic Rock Borer):P, Common in lower reds                            Leathesia (Rat Brain-Native): C, Common in lower reds",FALSE
ACAD,Acadia National Park,NETN,Northeast Temperate Network,OTTPOI,Otter Point,5/21/2022,44.30687286,-68.19048707,WGS84,FALSE,Medium,Low,Present,Absent,Low,Low,Medium,Low,Absent,Low,Low,Low,Absent,Patchy extreme bleachying,T1 bolt 11 missing,,"Rock gunnel, slippers, green sponge, chink snails, green doughnut eggs!",FALSE
ACAD,Acadia National Park,NETN,Northeast Temperate Network,LITMOO,Little Moose,6/26/2024,44.3311694,-68.04888157,WGS84,FALSE,Medium,Medium,Absent,,Low,Low,Low,Absent,Absent,Medium,Low,Low,Absent,,Fucus plot; reference plot for fucus plots mising,,Brittle star; dorid nudibranch,FALSE
ACAD,Acadia National Park,NETN,Northeast Temperate Network,LITMOO,Little Moose,5/18/2018,44.3311694,-68.04888157,WGS84,FALSE,Medium,Medium,Absent,Absent,Absent,Absent,Low,Absent,Absent,Low,Absent,Absent,Absent,See SHIHAR notes,Fucus 4: bottom left bolt missing (Not fixed),,"Northern red anemone, 'clouds"" of amphipods (swimming in lower tidepools)",FALSE
ACAD,Acadia National Park,NETN,Northeast Temperate Network,LITMOO,Little Moose,6/25/2016,44.3311694,-68.04888157,WGS84,FALSE,Medium,Low,Absent,Absent,Absent,Low,Absent,Absent,Absent,Low,Absent,Absent,Absent,,F2 has no ID washer?,Mink spotted in rocky intertidal. Harbor porpose spotted offshore. Settlement Plots (S1-5) Being treated likek U-plots . Entire site re-established last year (2015) This year (2016) is first read of data. We scraped all S plots (1-5) during this visit.,,FALSE
ACAD,Acadia National Park,NETN,Northeast Temperate Network,LITMOO,Little Moose,5/18/2022,44.3311694,-68.04888157,WGS84,FALSE,Medium,Medium,Low,Absent,Low,Absent,Absent,Low,Absent,Low,Low,Absent,Absent,"Cold impacted data collection, wind",,Merlin and mink seen,"Arctic rock borer, eel? Rock gunnel?, amphipod clouds in tide pool, tiny fish",FALSE
ACAD,Acadia National Park,NETN,Northeast Temperate Network,LITMOO,Little Moose,6/7/2019,44.3311694,-68.04888157,WGS84,FALSE,Medium,Low,Absent,Present,Low,Low,Low,Absent,Absent,Low,Low,Low,Absent,None,F4: Replaced missing bolt: Fixed,"Site in good shape, Spotted 1 Harbor Porpoise",Amphopods: Lots in the tide pools,FALSE
